question,option_A,option_B,option_C,option_D,answer
The thoracic cage is a structural unit important for which of the following functions?,Alimentation,Menstruation,Mentation,Respiration,D
The development of an egg without fertilization is known as,meiosis,parthenogenesis,embryogenesis,vegetative propagation,B
Which of the following statements about sidereal and solar days is not true?,The time it takes for the Sun to make one circuit of our sky is one solar day.,A solar day is 4 minutes longer than a sidereal day.,A solar day represents more than 360° of rotation for the earth.,The time it takes for the Moon to make one circuit of our sky is one solar day.,D
"A particle is constrained to move in a circle with a 10-meter radius. At one instant, the particle’s speed is 10 meters per second and is increasing at a rate of 10 meters per second squared. The angle between the particle’s velocity and acceleration vectors is",0°,30°,45°,60°,C
"As a young biologist, Charles Darwin had expected the living plants of temperate South America would resemble those of temperate Europe, but he was surprised to find that they more closely resembled the plants of tropical South America. The biological explanation for this observation is most properly associated with the field of",meteorology.,embryology.,vertebrate anatomy.,biogeography.,D
Which of the following is not an observation or inference on which natural selection is based?,There is heritable variation among individuals.,Poorly adapted individuals never produce offspring.,Species produce more offspring than the environment can support.,Individuals whose characteristics are best suited to the environment generally leave more offspring than those whose characteristics are less suited.,B
Stretching out from the equator is a wide belt of tropical rain forests that are being cut down to provide exotic woods for export to the U.S. and to make land available to graze beef cattle. Which of the following statements is a negative consequence of clear-cutting the tropical rain forests?,Indigenous populations will have access to modern conveniences.,There will be less precipitation in those clear-cut areas.,U.S. markets will have access to less expensive beef.,Deforestation will allow more sunlight to penetrate areas that were kept dark by dense vegetation.,B
Refer to question 15 for details on the squirrel population. Which of the following conditions is required to keep this population in Hardy-Weinberg equilibrium?,Random mating,Genetic drift,Mutation,Gene flow,A
The pattern of inheritance shown by malignant hyperthermia (hyperpyrexia) is:,autosomal dominant.,autosomal recessive.,X-linked dominant.,X-linked recessive.,A
Find the generator for the finite field Z_11.,1,2,3,4,B
"In Canada in 2014, the average wholesale price of soybeans was $0.24 per pound. In 2015, the average wholesale price of soybeans was $0.16 per pound. If a retailer purchased 20,000 pounds of soybeans in 2014 and in 2015, what was the percent change in the retailer’s expenses from 2014 to 2015?",–8%,–33%,–50%,8%,B
"When the Heisenberg uncertainty principle is applied to a quantum mechanical particle in the lowest energy level of a one-dimensional box, which of the following is true?","Momentum is known exactly, but no information about position can be known.","Position is known exactly, but no information about momentum can be known.",No information about either position or momentum can be known.,Neither position nor momentum can be known exactly.,D
Which of the following is the strongest Brønsted-Lowry acid?,HBrO,HBrO3,HBrO2,HBrO4,D
"In December, a toy store sold 934 puzzles. Each puzzle cost $6, including tax. What was the total cost of the puzzles sold, including tax?","$5,434 ","$5,484 ","$5,604 ","$5,684 ",C
You suspect that your patient has an enlarged submandibular salivary gland. You expect the enlarged gland,to be palpable intraorally..,to be palpable extraorally.,to be palpable both intra- and extraorally.,only to be detectable by radiographical examination.,C
During swallowing the,auditory tube opens.,cricopharyngeus muscle contracts.,rima glottis opens.,gag reflex is suspended.,A
"When driving from east to west in the U.S. from a forest ecosystem to grasslands, trees gradually give way to grasses. Which of the following is the critical factor responsible for this shift?",Amount of sunlight,Availability of oxygen,Availability of water,Length of growing season,C
Solve 13 over 4 = x over 7.,22.75,23.25,24.25,none of these,A
"A quote from a natural resources text states: ""Whenever the original ecosystem becomes restructured by man, it tends to become simplified, with a resultant disruption of the stabilizing influences of density-dependent regulatory factors."" This implies that in a disturbed ecosystem",there exist large populations of a low number of species,population levels of a species are kept at equilibrium through natural regulatory mechanisms,a given prey organism is subject to higher predation rates by more diverse predators,a given prey organism is less likely to undergo a population surge,A
"An ideal battery of constant voltage V supplies current to a circuit that has total resistance R. If R is doubled, what will happen to the total power dissipated by the circuit?",It will double.,It will quadruple.,It will be halved.,It will remain the same.,C
Which of the following is the most special characteristic of the adaptive immune system?,Antibodies,T cells,Memory T cells,Clonal expansion of pre-existing antibodies and/or T cells,D
Which of the following adaptive features would least likely be found in an animal living in a hot arid environment?,Long loops of Henle to maximize water reabsorption,Storage of water in fatty tissues,Large ears to aid in heat dispersion,Short loops of Henle to maximize water secretion,D
"Nerve outgrowth from a developing neuron begins at the growth cone, located at the tip of the axon. Microspikes of the growth cone extend and retract in order to move the growth cone forward. Exposure of the neuron to cytochasalin B at this stage of development causes",microtubules in the axon to undergo reversible dissociation,microtubules in the axon to undergo irreversible dissociation,microfilaments in the microspike to undergo reversible depolymerization,microfilaments in the microspike to undergo irreversible depolymerization,C
"At 20°C, a pipe open at both ends resonates at a frequency of 440 hertz. At what frequency does the same pipe resonate on a particularly cold day when the speed of sound is 3 percent lower than it would be at 20°C ?",414 Hz,427 Hz,433 Hz,440 Hz,B
What is the correct numerical value and unit of the Boltzmann constant?,1.38 × 10−21 m^3 · kg · s^−2 · K^−1,1.38 × 10−22 m^2 · kg · s^−3 · K^−1,1.38 × 10−23 m^2 · kg · s^−2 · K^−1,1.38 × 10−24 m^2 · kg · s^−2 · K^−2,C
Evaluate $\log_3 81$.,4,0.25,-1,27,A
"Two spheres of net charge +5e and -6e briefly come into contact. Afterward, which of the following is a possible combination of net charges for the two spheres?",+3e and -4e,+1.5e and -2.5e,Both of the above,None of the above,A
Which of the following best summarizes the process of allopatric speciation?,differential changes in allele frequencies → reproductive isolation → reproductive barriers → new species,catastrophic event → reproductive isolation → reproductive barriers → new species,reproductive isolation → differential changes in allele frequencies → reproductive barriers → new species,geographic isolation → reproductive isolation → differential changes in allele frequencies → reproductive barriers → new species,D
Which of the following agents will induce polyploidy in a dividing eukaryote?,Penicillin,Colchicine,Tetracycline,Puromycin,B
"3 cards are chosen at random from a standard 52-card deck. What is the probability that they form a pair? (A 3-card hand is a 'pair' if two of the cards match in rank but the third card is different. For example, 668 is a pair, but 999 is not.)",\frac{1}{8},\frac{1}{36},\frac{1}{78},\frac{72}{425},D
Statement 1 | There exists a free abelian group of every positive integer rank. Statement 2 | A finitely generated abelian group is free abelian if its Betti number equals the number of elements in some generating set.,"True, True","False, False","True, False","False, True",A
An updated version of classification shows the parvovirus family as having how many genera?,Having 5 genera,A very large number of virus types,Only a single virus,Only three viruses,B
The biggest single determinant of HIV transmission to the infant is:,Mother’age,Mother’s viral load,Mother’s immune status,Father’s viral load,B
The auditory tube,connects the inner ear and nasopharynx.,is derived from the second pharyngeal pouch.,is opened by the action of levator veli palatini.,is closed by the action of tensor veli palatini.,C
"Lily is going to give away all the pieces of candy in a bag. She can give an equal number of pieces of candy to 5, 3, or 2 people. Which number of pieces of candy could be in Lily’s bag?",12,20,30,45,C
Consider a ball rolling in a horizontal circular path on the inside surface of a cone. The normal force on the ball,is mg,is greater than mg always,may be greater or less than mg,is less than mg always,B
Blood flows from the right ventricle of the heart into which of the following structures?,Inferior vena cava,Left ventricle,Pulmonary arteries,Pulmonary veins,C
A completely submerged object always displaces its own,weight of fluid.,volume of fluid.,density of fluid.,All of these.,B
Given the expression: $1990\times1991 - 1989\times1990$. What counting number is equivalent to the expression?,5,8,3980,1160,C
Which of the following is the master gland of the endocrine system?,Adrenal,Pancreas,Pineal,Pituitary,D
When a fusion reaction converts a pair of hydrogen isotopes to an alpha particle and a neutron most of the energy released is in the form of,gamma radiation.,kinetic energy of the alpha particle.,kinetic energy of the neutron.,All of these about equally.,C
The endocrine system maintains homeostasis using many feedback mechanisms. Which of the following is an example of positive feedback?,"Infant suckling causes a mother's brain to release oxytocin, which in turn stimulates milk production.",An enzyme is allosterically inhibited by the product of the reaction it catalyzes.,When ATP is abundant the rate of glycolysis decreases.,"When blood sugar levels decrease to normal after a meal, insulin is no longer secreted.",A
"If $f(x) = 2$ for all real numbers $x$, what is the value of $f(x + 2)$?",2,4,0,1,A
Thermal conduction involves mainly,electrons,protons,neutrons,ions,A
"When you squeeze an air-filled party balloon, you increase its",volume,mass,weight,density,D
Samantha has 342 baseball cards. Perry has 184 baseball cards. How many more baseball cards does Samantha have than Perry?,158,168,258,268,A
"A soccer team has $90.00 to buy soccer balls. If one soccer ball costs $15.60, what is the greatest number of soccer balls the team can buy?",4,5,6,7,B
A tree is a connected graph with no cycles. How many nonisomorphic trees with 5 vertices exist?,1,2,3,4,C
"A subset H of a group (G,*) is a group if","a,b in H=> a * b in H",a in H => a^-1 in H,"a,b in H=> a * b^-1 in H",H contains the identity element,C
The primary source of the Sun’s energy is a series of thermonuclear reactions in which the energy produced is c^2 times the mass difference between,two hydrogen atoms and one helium atom,four hydrogen atoms and one helium atom,six hydrogen atoms and two helium atoms,three helium atoms and one carbon atom,B
Which of the following statements about the DNA in one of your liver cells is correct?,Your liver cells contain the same DNA as your white blood cells.,Most of the DNA in your liver cells will be transcribed but not translated.,Most of the DNA in your liver cells will be transcribed in the nucleus and translated in the cytoplasm.,"DNA in your liver cells contains genes unique to storing glycogen, while other cells do not contain those genes.",A
When will Kp and Kc have the same numerical value?,At absolute zero for all reactions,When the concentrations are at standard state,When the concentrations are all 1.00 molar,When the reaction exhibits no change in pressure at constant volume,D
We were first able to accurately measure the diameter of Pluto from:,a New Horizons flyby in the 1990s,Hubble Space Telescope images that resolved Pluto's disk,brightness measurements made during mutual eclipses of Pluto and Charon,radar observations made by the Arecibo telescope,C
"The X-band (9.5 GHz) EPR spectrum of a matrix isolated Na atom reveals four hyperfine lines with resonant field positions of 3074 G, 3174 G, 3274 G and 3374 G. Calculate the g value of the atom.",g = 2.002,g = 1.950,g = 2.250,g = 2.005,A
"Sulfurous acid is a weak acid, while sulfuric acid is a much stronger acid because",the sulfur in sulfuric acid is more electronegative than the sulfur in sulfurous acid,sulfuric acid has more oxygen atoms in its formula,the O–H bonds in sulfuric acid are much weaker than those in sulfurous acid,sulfurous acid has its hydrogen atoms bound directly to the sulfur atom,C
Maria spends $9 on lunch each day she is at work. To find how much money she spends on lunch during a 5-day work week she multiplies 5 × 9. How much money does Maria spend on lunch during a 5-day work week?,$40 ,$45 ,$50 ,$59 ,B
Which of the following statements is not a reason why tetramethylsilane is used as a 1H chemical shift reference.,Its 1H spectrum is a singlet.,Its protons are quite strongly shielded.,It dissolves in most organic solvents.,Most organic compounds do not contain silicon atoms.,D
A cannonball is fired horizontally at 10 m/s from a cliff. Its speed one second after being fired is about,10 m/s,14 m/s,16 m/s,20 m/s,B
The pattern of inheritance shown by glucose-6-phosphate dehydrogenase (G6PD) deficiency is:,autosomal dominant.,autosomal recessive.,X-linked dominant.,X-linked recessive.,D
Mouse sperm contain receptor proteins that bind to a glycoprotein (ZP3) in the zona pellucida of mouse eggs. Binding of ZP3 receptors to ZP3 initiates the sperm’s acrosomal reaction. All of the following experimental observations would be expected EXCEPT:,Injecting eggs with antibodies that bind to ZP3 blocks in vitro fertilization.,Incubating sperm with purified ZP3 prior to mixing sperm and eggs blocks in vitro fertilization.,Incubating eggs with antibodies that bind to ZP3 blocks in vitro fertilization.,"Coating synthetic beads with a different glycoprotein, ZP2, fails to lead to sperm aggregation on the beads.",A
Which of the following would be the most dependable environmental signal that a plant in a temperate ecosystem could use to initiate flowering at the correct time of the year?,Circadian rhythm,Photoperiod,Changing air temperature,Fluctuations in abscisic acid levels,B
"Statement 1 | S_n is non-Abelian for all n >= 3. Statement 2 | If a is a permutation that is an m-cycle and b is a permutation that is an n-cycle, then |ab| = lcm(m,n).","True, True","False, False","True, False","False, True",C
There is no vaccine against HIV because of which of the following?,The virus is so antigenically variable,Such a vaccine would be too expensive,The virus can be controlled by a change in sexual habits,Latency can abrogate any vaccine effect,B
"The 99Ru chemical shift of [Ru(H2O)6]2+ is 16,050 ppm relative to [Ru(CN)6]2- at 0 ppm. The electronic excitation energies of [Ru(H2O)6]2+, [Ru(CN)6]2- and [Ru(NH3)6]2+ are 18,900, 40,000 and 25,600 cm-1 respectively. Assuming that the chemical shift differences are dominated by paramagnetic currents, determine the chemical shift of [Ru(NH3)6]2+.","7,530 ppm","8,090 ppm","11,070 ppm","14,840 ppm",B
Find the number that makes the statement true: 26.1 mm = _ dm.,0.261,261,2.61,"2,610",A
In which set do all of the values make the inequality 2x — 1 < 10 true?,"{10, 15, 20}","{5, 7, 9}","{4, 6, 8}","{2, 3, 4}",D
"At the beginning of a class period, half of the students in a class go to the library. Later in the period, half of the remaining students go to the computer lab. If there are 8 students remaining in the class, how many students were originally in the class?",12 students,16 students,24 students,32 students,D
An electric dipole consists of a pair of equal but opposite point charges of magnitude 4.0 nC separated by a distance of 2.0 cm. What is the electric field strength at the point midway between the charges?,0,9.0 × 10^4 V/m,1.8 × 10^5 V/m,7.2 × 10^5 V/m,D
Both C4 and CAM plants employ physiological and biochemical strategies to reduce photorespiration. Which of the following is an accurate comparison of the two strategies?,"C4 plants fix CO2 as the 4-carbon acid oxaloacetate, while CAM plants fix CO2 as the 5-carbon acid ribulose 1, 5-bisphosphate.","C4 plants fix CO2 in the mesophyll but carry out the Calvin cycle in the bundle sheath, while CAM plants fix CO2 and carry out the Calvin cycle in the mesophyll.","C4 plants fix CO2 in the bundle sheath but carry out the Calvin cycle in the mesophyll, while CAM plants fix CO2 and carry out the Calvin cycle in the bundle sheath.","C4 plants store CO2 as phosphoglycolate, while CAM plants store CO2 as oxaloacetate.",B
The weekly milk order for the Tranquility Inn includes 40 gallons of low-fat milk and 15 gallons of chocolate milk. What is the ratio of the number of low-fat gallons to chocolate gallons in the Tranquility Inn’s weekly milk order?,3:01,5:01,5:03,8:03,D
All of the following may serve as intracellular messengers EXCEPT,calcium ions,cAMP,acetylcholine,"inositol 1,4,5-triphosphate",C
The schedule for a music showcase includes 3 sets that are 20 minutes each and 1 set that is 40 minutes. There is a 10-minute break between each set. The total length of the music showcase is 3(20 + 10) + 40 minutes. What is the total length of the music showcase?,73 minutes,110 minutes,130 minutes,210 minutes,C
The sum $1^2 + 2^2 + 3^2 + 4^2 + \cdots + n^2 = n(n+1)(2n+1) \div 6$. What is the value of $21^2 + 22^2 + \cdots + 40^2$?,41,22140,19270,2870,C
Which of the following best describes the location where the carotid pulse can be found?,In front of the ears and just above eye level,In the antecubital space,In the middle of the groin,On the anterior side of the neck,D
To say that a rose petal is red is to say that it,absorbs red,reflects red,emits red,transmits red,B
Which of the following is the symplastic pathway for the movement of sucrose from the site of photosynthesis in mesophyll cells into the phloem?,"Fibers, phloem parenchyma, companion cell, sieve tube","Phloem parenchyma, fibers, bundle sheath, tracheids","Companion cells, phloem parenchyma, fibers, sieve tube","Bundle sheath, phloem parenchyma, companion cell, sieve tube",D
Find the maximum possible order for some element of Z_8 x Z_10 x Z_24.,8,120,240,24,B
"Recently, seasonal dead zones in low-oxygen waters have been occurring annually in the Gulf of Mexico near the mouth of the Mississippi River. The dead zones result from the rapid growth of photosynthetic phytoplankton (algal blooms) and their subsequent decay by oxygen-depleting microbes in the water column. Which of the following factors most likely triggers the algal blooms and the associated dead zones?",A decrease in the light level in surface waters as day length starts to shorten after the summer solstice,Increased predation by marine larvae and other zooplankton during the summer months,A summer influx of nutrients derived from chemical fertilizers that are high in nitrogen and phosphorus,Decreased competition from other marine phytoplankton during the summer months,C
Find 1 over 6 + 1 over 8.,7 over 24,2 over 14,1 over 7,1 over 4,A
"Statement 1 | If a R is an integral domain, then R[x] is an integral domain. Statement 2 | If R is a ring and f(x) and g(x) are in R[x], then deg (f(x)g(x)) = deg f(x) + deg g(x).","True, True","False, False","True, False","False, True",C
"Find the sum of the primes between 100 and 200, inclusive, that are 1 or 2 more than a perfect square.",102,298,256,300,B
"A children’s toy consists of a cart whose very light wheels are attached to a rubber band. This rubber band can wind and unwind around the axle supporting the wheels. This toy is given a shove, after which the toy rolls across a flat surface and up a ramp. It is observed that the toy does not go a consistent distance up the ramp—in some trials it ends up higher than in other trials, even though the shove imparts the same kinetic energy to the cart each time. Which of the following is a reasonable explanation for this phenomenon?","Depending on how the rubber band is initially wound, more or less potential energy can be transferred from the rubber band to the kinetic energy of the car’s motion.",The normal force on the cart’s wheels will be different depending on how much the rubber band winds or unwinds.,How much energy is transferred from kinetic energy to gravitational potential energy depends on the vertical height at which the cart ends up.,Some of the cart’s initial kinetic energy will be dissipated due to work done by friction.,A
The major difference between cartilage and bone is that cartilage,is a part of the skeletal system,is composed of collagen and salts,lacks blood vessels and nerves,secretes a matrix,C
"Which of the following is the best estimate for 4,286 × 390?","12,000,000","1,600,000","1,200,000","16,000",B
Let G denoted the set of all n x n non-singular matrices with rational numbers as entries. Then under multiplication G is a/an,subgroup,finite abelian group,"infinite, non abelian group","ininite, abelian",C
Which of the following is a reduction half-reaction? (1) Cu2+ + e- → Cu+ (2) Cu+ + e- → Cu0 (3) Fe2+ → Fe3+ + e-,1 only because copper(II) ions are reduced,3 only because the iron is reduced,1 and 2 because they both reduce copper ions,1 and 3 because they do not have insoluble ions,C
"If 1.0 g of rubidium and 1.0 g of bromine are reacted, what will be left in measurable amounts (more than 0.10 mg) in the reaction vessel?",RbBr only,RbBr and Rb only,RbBr and Br2 only,"RbBr, Rb, and Br2",C
Monatomic ions of the representative elements are often,very soluble,very electronegative,isoelectronic with a noble gas,highly colored,C
"What is the orbital angular momentum quantum number, l, of the electron that is most easily removed when ground-state aluminum is ionized?",3,2,1,0,C
Which of the following lists the ingredients of the solar nebula from highest to lowest percentage of mass in the nebula?,hydrogen compounds (H2O CH4 NH3) light gases (H He) metals rocks,hydrogen compounds (H2O CH4 NH3) light gases (H He) rocks metals,light gases (H He) hydrogen compounds (H2O CH4 NH3) metals rocks,light gases (H He) hydrogen compounds (H2O CH4 NH3) rocks metals,D
"Certain populations of finches have long been isolated on the Galapagos Islands off the western coast of South America. Compared with the larger stock population of mainland finches, these separate populations exhibit far greater variation over a wider range of species. The variation among these numerous finch species is the result of",convergent evolution,divergent evolution,disruptive selection,stabilizing selection,B
Sexual dimorphism is most often a result of,pansexual selection.,stabilizing selection.,intrasexual selection.,intersexual selection.,D
"John noticed that the angle formed by the minute hand and hour hand on a standard 12-hour clock was 110 degrees when he left home after 6 p.m.; it was also 110 degrees when he returned after 6 p.m. but before 7 p.m. that same night. If he left home for more than five minutes, for how many minutes was he away?",36,40,38,43,B
Solve the equation 18 + p = 29.,−47,−11,11,47,C
"The Sojourn family went on a vacation. They started with $2000. If they spent $150 each day, which expression represents how much money they had after x days?",1850x,2000 −150x,150x,2000 +150x,B
Which of the following types of electromagnetic radiation has the longest wavelength?,Gamma rays,Ultraviolet,Blue light,Orange light,D
"In humans, each cell normally contains ______ of chromosomes.",11 pairs,23 pairs,32 pairs,46 pairs,B
"Lucy is making gift baskets. She puts 3 apples in each gift basket. Which number sentence shows how to find the total number of gift baskets, b, Lucy can make with 24 apples?",24 + 3 = b,3 + b = 24,24 ÷ b = 3,3 × 24 = b,C
A comet of mass m impacts the earth (mass M radius R) at the minimum impact speed. What is the expression for the total energy released in the impact?,m*v,0.5*m/(R^3),0.5*m*(2GM/R),0.6*G(M^2)/R,C
"Ramanujan and Hardy played a game where they both picked a complex number. If the product of their numbers was $32-8i$, and Hardy picked $5+3i$, what number did Ramanujan pick?",32-8i,5+3i,4-i,4-4i,D
"In the xy-plane, the graph of x^(log y) = y^log x is",the open first quadrant,a closed curve,a ray in the open first quadrant,a single point,A
"In a circuit of two lamps in parallel, if the current in one lamp is 2 A, the current in the other lamp is",about 1 A,2 A,Depends on which lamp is closer to the battery,Not enough information to say,D
Write the prime factorization of 48. Use exponents where possible.,4 • 8,6 • 8,2^3 • 3^2,2^4 • 3,D
The star Betelgeuse is one of the brightest stars in the night sky with remarkable red color. In which constellation is Betelgeuse located?,Cassiopeia,Cygnus,Ursa Major,Orion,D
The proportion of genes shared by first cousins is on average ___.,1.0/2,1.0/4,1.0/8,1.0/16,C
The phenomenon of interference occurs for,sound waves,light waves,Both of these,Neither of these,C
The molecule with a tetrahedral shape is,PCl4F,BF3,CO2,CBr4,D
