question,option_A,option_B,option_C,option_D,answer
All of the following are examples of events that can prevent interspecific breeding EXCEPT,the potential mates experience geographic isolation,the potential mates experience behavioral isolation,the potential mates have different courtship rituals,the potential mates have similar breeding seasons,D
A “benefit” of research may accrue:,To the participant,To his/her family,To society,All of the above,D
Find the remainder when 25^1059 is divided by 23.,11,13,8,5,C
"In a nonrelativistic, one-dimensional collision, a particle of mass 2m collides with a particle of mass m at rest. If the particles stick together after the collision, what fraction of the initial kinetic energy is lost in the collision?",0,1/4,1/3,1/2,C
"In a population of giraffes, an environmental change occurs that favors individuals that are tallest. As a result, more of the taller individuals are able to obtain nutrients and survive to pass along their genetic information. This is an example of",directional selection.,stabilizing selection.,sexual selection.,disruptive selection.,A
The eigenvalues of a Hermitian operator are always,real,imaginary,degenerate,linear,A
Find the exact answer: 942 / 3,214,304,314,642,C
Describe the morphology of a togavirus.,Enveloped spherical particles with an icosahedral structure,Non-enveloped with an icosahedral structure,Filamentous virus with protruding glycoproteins,Small round viruses,A
Which areas of the world are rabies free?,USA,Norway,EU,"Island nations, UK, NZ and Australia",D
A simple and correct way to comprehend satellites orbiting Earth is to view them as,balanced between gravitational and centripetal forces.,beyond the main pull of Earth gravity.,in mechanical equilibrium with a net force of zero.,having sufficient tangential velocities to fall around rather than into Earth.,D
"In the equation $|x-4| -10 = 2$, what is the product of all possible values of $x$?",-8,128,-128,16,C
The complementary color of blue is,magenta,yellow,cyan,white,B
"A number, rounded to the nearest thousand,is 47,000. Which number could be the number that was rounded?","46,295","46,504","47,520","47,924",B
"Two people, one of mass 100 kg and the other of mass 50 kg, stand facing each other on an ice-covered (essentially frictionless) pond. If the heavier person pushes on the lighter one with a force F, then",the force felt by the heavier person is (-1/2)F,the force felt by the person is -2F,the magnitude of the acceleration of the lighter person will be half of the magnitude of the acceleration of the heavier person,the magnitude of the acceleration of the lighter person will be twice the magnitude of the acceleration of the heavier person,D
What is the least possible positive integer-value of $n$ such that $\sqrt{18\cdot n \cdot 34}$ is an integer?,15,10,17,34,C
"When the dichromate ion is reacted, one of its most common products is Cr3+. What is the oxidation state (oxidation number) of chromium in the dichromate ion? Does reduction or oxidation occur when dichromate forms Cr3+?","3+, reduction","12+, reduction","6+, reduction","6+, oxidation",C
Which of the following conditions is characterized by the presence of kidney stones (renal calculi)?,Glomerulonephritis,Interstitial nephritis,Nephrolithiasis,Polycystic kidney,C
Imagine you're standing on the surface of a shrinking planet. If it shrinks to one-tenth its original diameter with no change in mass on the shrunken surface you'd weigh,1/100 as much,10 times as much,100 times as much,1000 times as much,C
"The $n^{\text{th}}$ term of a certain geometric series is given by $a\cdot r^{n-1}$, where $a$ and $r$ are positive integers and $r$ is greater than 1. Bill picks out $k$ different numbers in this sequence, all of which have the same number of digits. What is the largest possible value of $k$?",4,5,8,16,A
"What is the quotient of 1,248 / 7?",177 remainder 9,168 remainder 2,178 remainder 2,178 remainder 3,C
"At very high speeds, an object appears to an observer at rest to be",shorter in the direction of travel.,shrunken in all directions.,shorter in the direction perpendicular to travel.,longer in all directions.,A
Why did Ptolemy have the planets orbiting Earth on ‘circles upon circles’ in his model of the universe?,To explain why more distant planets take longer to make a circuit through the constellations of the zodiac.,To explain the fact that planets sometimes appear to move westward rather than eastward relative to the stars in our sky.,To explain why the Greeks were unable to detect stellar paralax.,To properly account for the varying distances of the planets from Earth.,B
An electron can be speeded up by,an electric field,a magnetic field,Both of these,Neither of these,A
"Ichthyosaurs were aquatic dinosaurs. Fossils show us that they had dorsal fins and tails, as do fish, even though their closest relatives were terrestrial reptiles that had neither dorsal fins nor aquatic tails. The dorsal fins and tails of ichthyosaurs and fish are",homologous.,examples of convergent evolution.,adaptations to a common environment.,B and C only,D
What is the area of an equilateral triangle whose inscribed circle has radius 2?,12,16,12*sqrt(3),16*sqrt(3),C
A wave transfers,amplitude,wavelength,frequency,energy,D
"Sulfur dioxide reacts with oxygen to form sulfur trioxide in the presence of a catalyst. The equilibrium constant, Kp, at a certain temperature is 3.0 × 10^22. A 2.0-liter flask has enough SO3 added to it to produce a pressure of 0.789 atm Hg. After the reaction comes to equilibrium, the expected partial pressure of O2 will be",2.88 × 10^-6 torr,3 × 10^-18 mm Hg,1100 mm Hg,1.32 × 10^-5 torr,D
The magnetic force on a moving charged particle can change the particle's,speed,direction,Both of these,Neither of these,B
"A baker made 232 muffins. He sent 190 of the muffins to a local hotel. He will put the rest of the muffins in boxes. Each box can hold 6 muffins. Which equation can be used to find 6, the number of boxes the baker will need?",(232 - 190)/6=b,(232 + 190)x6=b,(232 - 190)x6=b,(232 + 190)/6=b,A
Each of the following ionized isotopes is projected with the same speed into a uniform magnetic field B such that the isotope's initial velocity is perpendicular to B. Which combination of mass and charge would result in a circular path with the largest radius?,"m = 16 u, q = –5 e","m = 17 u, q = –4 e","m = 18 u, q = –3 e","m = 20 u, q = –1 e",D
Which of the following conditions is characterized by incompetence of the esophageal sphincter?,Crohn's disease,Esophageal varices,Gastroesophageal reflux disease,Pyloric stenosis,C
"In men, which of the following structures is located at the neck of the bladder and surrounds the urethra?",Epididymis,Prostate,Scrotum,Seminal vesicle,B
A high blood ammonia level occurs in:,galactosaemia.,Hurler's syndrome.,ornithine transcarbamylase (OTC) deficiency.,phenylketonuria.,C
Under which conditions will a real gas most closely behave as an ideal gas?,High temperature and high pressure,High temperature and low pressure,High volume and high temperature,Low temperature and low pressure,B
The largest Latino community in the U.S. is:,Puerto Rican,Mexican,Cuban,Brazilian,B
"When potassium perchlorate, KClO4, dissolves in water, the temperature of the resultant solution is lower than the initial temperature of the components. Which of the following conclusions may be related to this?",This is a spontaneous process because it is exothermic.,This is a spontaneous process because of an entropy increase.,This is a spontaneous process because of an entropy decrease.,This is a spontaneous process because it is exothermic.,B
Why are members of the astrovirus family only recently recognised as significant enteric viruses for humans?,The genome has been identified by the new method of deep sequencing,A new vector has been discovered,They infect a wide range of domestic animals and so contaminate meat,Knowledge of their replication as positive sense ssRNA viruses is now complete,A
"Statement 1 | Any set of two vectors in R^2 is linearly independent. Statement 2 | If V = span(v1, ... , vk) and {v1, ... , vk} are linearly independent, then dim(V) = k.","True, True","False, False","True, False","False, True",D
"If the finite group G contains a subgroup of order seven but no element (other than the identity) is its own inverse, then the order of G could be",27,28,35,37,C
"Stephanie flew 2,448 miles from Los Angeles to New York City. What is the number of miles Stephanie flew rounded to the nearest thousand?","2,000","2,400","2,500","3,000",A
An animal cell that is permeable to water but not salts has an internal NaCl concentration of 10%. If placed in freshwater the cell will,plasmolyze,swell and eventually lyse,endocytose water into a large central vacuole,shrivel,B
Noise-canceling devices make use of sound,destruction,interference,resonance,amplification,B
"In a hypothetical population's gene pool, an autosomal gene, which had previously been fixed, undergoes a mutation that introduces a new allele, one inherited according to incomplete dominance. Natural selection then causes stabilizing selection at this locus. Consequently, what should happen over the course of many generations?",The proportions of both types of homozygote should decrease.,The proportion of the population that is heterozygous at this locus should remain constant.,The population's average heterozygosity should increase.,Both A and C,D
"Statement 1 | If H is a subgroup of G and a belongs to G then |aH| = |Ha|. Statement 2 | If H is a subgroup of G and a and b belong to G, then aH and Hb are identical or disjoint.","True, True","False, False","True, False","False, True",C
The molar heat of vaporization of water is +43.9 kJ. What is the entropy change for the vaporization of water?,8.49 J mol-1 K-1,4.184 J mol-1 K-1,2.78 J mol-1 K-1,118 J mol-1 K-1,D
How are antibody producing cells stimulated?,Interacting with a virus short peptide,Interacting with a T helper cell.,Interacting with a plasma cell,Interacting with a virus infected cell,B
"Jane's quiz scores were 98, 97, 92, 85 and 93. What was her mean score?",92,93,94.5,95,B
"Marshall wants to finish typing his English paper before class starts. If he still has 550 words left to type and class starts in 25 minutes, at least how fast must Marshall type to finish his paper on time?",20 words per minute,21 words per minute,22 words per minute,25 words per minute,C
A rod measures 1.00 m in its rest system. How fast must an observer move parallel to the rod to measure its length to be 0.80 m?,0.50c,0.60c,0.70c,0.80c,B
"Of the following atoms, which has the lowest electron affinity?",F,Si,O,Ca,D
"0.25 mol of a weak, monoprotic acid is dissolved in 0.25 L of distilled water. The pH was then measured as 4.26. What is the pKa of this weak acid?",4.26,8.52,7.52,3.66,B
Why are drug combinations essential for HIV?,Single drugs are not completely inhibitory,Mutations negate the effect of one drug,Combinations of antibiotics are effective versus TB,The virus cannot mutate vs a combination,C
Which statement concerning the atrioventricular bundle is correct?,It is formed of autonomic nerve processes and is the only electrical connection between the atria and the ventricles.,It is formed of Purkinje fibres and is the only electrical connection between the atria and the ventricles,It is formed of autonomic nerve processes and forms one of several electrical connections between the atria and ventricles.,It is formed of Purkinje fibres and forms one of several electrical connections between the atria and ventricles.,B
When an increase in speed doubles the kinetic energy of a moving body its momentum,increases but less than doubles,doubles,more than doubles,depends on factors not stated,A
If you lived on Venus what phases of the Earth would you see? (Assume your telescope can see through Venus’s thick clouds…),New first quarter full third quarter,Waning crescent New Waxing crescent,Waxing gibbous Full Waning gibbous,New only,C
"Of the following oxo acids, which is predicted to be the strongest acid?",HBrO,HClO,HIO,HClO3,D
Which of the following statements about meiosis is correct?,The daughter cells are genetically identical to the parent cells.,Homologues pair during prophase II.,DNA replication occurs before meiosis I and meiosis II.,The number of chromosomes is reduced.,D
A grocerystore sells a bag of 5 lemons for $2.00. What is the unit cost of each lemon in the bag?,$2.50 ,$0.60 ,$0.40 ,$0.10 ,C
"Many virus infections result in immune pathology, this is caused predominantly by which of the following?",A cytokine storm,Antibody mediated reactions,A response of killer T cells (CD-8),A decline in function of the immune system,A
Find the maximum possible order for an element of S_n for n = 10.,6,12,30,105,C
"The lowest possible temperature is absolute zero, at",0 kelvin,−273°C,Both are the same,None of these,C
Fertilization of an ovum by a spermatozoon occurs in which of the following structures?,Cervix,Fallopian tube,Ovary,Uterus,B
"A charged particle moves through a magnetic field and experiences a force f. New particles are sent into the same magnetic field. If the new particles have twice the charge, twice the mass, and twice the velocity, the new force would be",4F,2F,F,1/2 F,A
Express $0.1\overline{7}$ as a common fraction.,\frac{8}{45},\frac{8}{5},\frac{8}{7},\frac{8}{33},A
"What is the value of the expression 2,816 x 7?","14,572","14,672","19,612","19,712",D
"In determining the order for reactant A in a certain reaction, the concentrations of all other reactants are held constant while the concentration of A is tripled from one experiment to another. The reaction rate is found to triple. The appropriate exponent for A in the rate law is",1,2,3,4,A
Warning coloration adopted by animals that possess a chemical defense mechanism.,Aposomatic coloration,Batesian mimicry,Deceptive markings,Cryptic coloration,A
"Compared with the power input, the power output of an ideal transformer is",greater,less,the same,Any of these,C
Cellular uptake of cholesterol occurs through internalization of low density lipoproteincholesterol complexes. Cholesterol uptake involves all of the following EXCEPT,cell-surface receptors,adhesion plaques,endosome formation,receptor-mediated endocytosis,B
"A certain autosomal recessive trait is expressed in 1% of a population. Assuming that the population is in Hardy-Weinberg equilibrium, what percent of the population are carriers but do not express the trait?",10%,18%,27%,50%,B
"The dissociation energy for a hydrogen-bromine bond is defined as the change in enthalpy, DH, for which of the following reactions?",2 HBr(g) → H2(g) + Br2(l),HBr(g) → H+(g) + Br−(g),H(g) + Br(g) → HBr(g),HBr(g) → H(g) + Br(g),D
The phrenic nerves innervate the,diaphragm.,diaphragm and parietal pleura.,"diaphragm, parietal pleura and pericardium.","diaphragm, parietal pleura, pericardium and intercostals muscles.",C
"If a total of 762 students at a citywide competition are divided into 6 equal-sized teams, how many students are on each team?",110,120,127,137,C
Which of the following countries has sent landers to Venus?,The U.S.S.R.,The U.S.,France,A and B,A
"When wind speeds up as it blows over the top of a hill, atmospheric pressure there",increases,decreases,isn’t affected,reduces to zero,B
Most surveillance systems use which of the following study designs?,Cohort,Serial cross-sectional,Mortality,Syndromic,B
Which statement is true?,"If f(x) is continuous at x = c, then f′(c) exists.","If f′(c) = 0, then f has a local maximum or minimum at (c, f (c)).","If f′′(c) = 0, then the graph of f has an inflection point at (c, f (c)).","If f is differentiable at x = c, then f is continuous at x = c.",D
The three countries with the most drug injectors are:,"Bolivia, Argentina, Thailand","China, the U.S. and Russia","Afghanistan, Iraq and Myanmar","Lithuania, Estonia and Latvia",B
"Mr. Kohlberg owns a flower shop. At the beginning of the day, he had 152 roses. Mr. Kohlberg sold 96 of the roses and then wanted to separate the rest of the roses equally among 8 vases. What will be the total number of roses in each vase?",7,12,48,56,A
London dispersion forces are caused by,temporary dipoles created by the position of electrons around the nuclei in a molecule,the three-dimensional intermolecular bonding present in all covalent substances,the uneven electron-to-proton ratio found on individual atoms of a molecule,the electronegativity differences between the different atoms in a molecule,A
Which one of the following statements is true:,Protons and neutrons have orbital and spin angular momentum.,"Protons have orbital and spin angular momentum, neutrons have spin angular momentum.",Protons and neutrons possess orbital angular momentum only.,Protons and neutrons possess spin angular momentum only.,C
The infraorbital nerve,is a terminal branch of the maxillary division of the trigeminal nerve.,is a terminal branch of the maxillary branch of the facial nerve.,carries parasympathetic secretomotor neurons to the lacrimal gland.,innervates the inferior part of the orbicularis oculi muscle.,A
"The members of a bird species capable of nesting in treetops or on the ledges of nearby cliffs make their homes only in the treetops due to the established presence of a more aggressive bird species on the cliff ledges. With respect to habitat, the treetop-nesting birds are utilizing",their fundamental niche only,their realistic niche only,their ecological niche only,neither their fundamental niche nor their realistic niche,B
"In a mixture of hydrogen, oxygen, and nitrogen gases at a given temperature, the fastest molecules on average are those of",hydrogen,oxygen,nitrogen,All have same average speed,A
The Space Shuttle orbits 300 km above the Earth’s surface; the Earth’s radius is 6400 km. What is the acceleration due to Earth’s gravity experienced by the Space Shuttle?,4.9 m/s^2,8.9 m/s^2,9.8 m/s^2,10.8 m/s^2,B
Hybrids between some related species of plants are sterile because the parent plants had different chromosome numbers. Occasionally the chromosome number of such a hybrid plant doubles spontaneously. Which of the following best describes the descendants of those plants with the double chromosome number?,The plant with the double chromosome number would be genetically defective and have no descendants.,The descendants would be at a selective advantage because of the increased ability to introgress.,The descendants would be reproductively successful because they could backcross with the parental species.,The descendants would regain the ability to reproduce sexually because chromosomes could pair normally.,D
NH4+(aq) + NO2- (aq) → N2(g) + 2H2O(l) Increasing the temperature of the above reaction will increase the rate of reaction. Which of the following is NOT a reason that increased temperature increases reaction rate?,The reactants will be more likely to overcome the activation energy.,The number of collisions between reactant molecules will increase.,A greater distribution of reactant molecules will have high velocities.,Alternate reaction pathways become available at higher temperatures.,D
Express as a common fraction the reciprocal of $0.\overline7$.,\frac{7}{2},\frac{7}{9},\frac{9}{2},\frac{9}{7},D
"In reference to a segment of DNA, which of the following molecules contains the fewest number of nucleotides?",a single strand of the original DNA segment,a single strand of the original DNA segment after a point mutation,the primary RNA transcript (before splicing) from the original DNA,a single strand of complementary DNA (cDNA) made from the original DNA,D
Which of the following statements best summarizes evolution as it is viewed today?,It is goal-directed.,It represents the result of selection for acquired characteristics.,It is synonymous with the process of gene flow.,It is the differential survival and reproduction of the most-fit phenotypes.,D
"At 25°C, the maximum amount of PbI2 that can be dissolved in 1.00 L of pure water is 1.0 mmol. Assuming complete dissociation, the solubility product, K_sp, for lead iodide at 25°C is",1.0 × 10^−3,1.0 × 10^−6,1.0 × 10^−9,4.0 × 10^−9,D
Restate the expression 4(3 + 2) using the Distributive Property. Do not simplify.,4(3) + 2,4(3) + 4(2),20,3 + 4(2),B
Which of the following is a second messenger that stimulates release of calcium ions into the cytoplasm?,Prostaglandins,Inositol triphosphate,Cyclic AMP,Calmodulin,B
What is the strength (B1) of a 13C 90° pulse of duration 1 μs?,3.72 mT,5.18 mT,17.0 mT,23.3 mT,B
The normal human chromosome diploid number is:,23,24,46,48,C
Which net ionic equation below represents a possible reaction that takes place when a strip of magnesium metal is oxidized by a solution of chromium (III) nitrate?,Mg(s) + Cr(NO3)3(aq) → Mg2+(aq) + Cr3+(aq) + 3NO3-(aq),3Mg(s) + 2Cr3+ → 3Mg2+ + 2Cr(s),Mg(s) + Cr3+ → Mg2+ + Cr(s),3Mg(s) + 2Cr(NO3)3(aq) → 3Mg2+(aq) + 2Cr(s) + NO3-(aq),B
Homeobox sequences,are present in the genome of many animal species,are found in prokaryotes but not in eukaryotes,were identified as the integration sites for bacterial viruses,represent integration sites for transposable elements,A
Which of the following statements about the immune system is NOT correct?,"Innate immunity, also known as the adaptive immune response, relies on circulating phagocytes engulfing foreign substances.",Adaptive immunity is a slower response than innate immunity.,Innate immunity activates a humoral response.,Dendritic cells are antigen presenting cells.,A
"When a diver points a flashlight upward toward the surface of the water at an angle 20° from the normal, the beam of light",totally internally reflects,passes into the air above,is absorbed,None of these,B
"A case-control study is conducted to assess the association between alcohol consumption and lung cancer patients with lung cancer and 100 controls are asked about their past alcohol consumption. According to the study results, alcohol consumption is strongly associated with lung cancer (OR = 2.5). The researchers then divide the study subjects into two groups: smokers and non-smokers. Subsequent statistical analysis does not reveal any association between alcohol consumption and lung cancer within either group. The scenario described is an example of which of the following?",Observer bias,Confounding,Placebo effect,Nonresponse bias,B
The red glow in the neon tube of an advertising sign is a result of,fluorescence,incandescence,de-excitation,polarization,C
"If the value of x is between 0.0051 and 0.038, which of the following could be x?",0.0042,0.0261,0.049,0.052,B
The quadratic $2x^2+5x+12=19-7x$ has two solutions. What is the positive difference between these solutions?,2,\sqrt{2},5\sqrt{2},5,C
"Let C be the circle in the yz-plane whose equation is (y - 3)^2 + z^2 = 1. If C is revolved around the z-axis, the surface generated is a torus. What is the equation of this torus?",x^2 + y^2 + z^2 + 8 = 6y,(x^2 + y^2 + z^2)^2 = 8 + 36(x^2 + z^2),(x^2 + y^2 + z^2 + 8)^2 = 36(x^2 + z^2),(x^2 + y^2 + z^2 + 8)^2 = 36(x^2 + y^2),D
"The mass of the Earth is 5.97 × 10^24 kg. The Moon, whose center is 3.84 × 10^8 m from the Earth’s center, has mass 7.35 × 10^22 kg. Which of the following is the best estimate of the gravitational force of the Earth on the Moon?",10^39 N,10^29 N,10^19 N,10^9 N,C
Which of the following is the large bone found superior to the patella and inferior to the ischium?,Calcaneus,Femur,Symphysis pubis,Tibia,B
"A sphere, a cube, and a cylinder, all of equal mass, are released from rest from the top of a short incline. The surface of the incline is extremely slick, so much so that the objects do not rotate when released, but rather slide with negligible friction. Which reaches the base of the incline first?",the sphere,the cube,the cylinder,All reach the base at the same time.,D
"Let $a\star b = a^b-ab$. If $2\star x = 22$, find $x$.",5,22,11,6,A
A DNA strand with the sequence 5′ CGA TTG 3′ would be complementary to the sequence,5′ GCU AAC 3′,5′ GCT AAC 3′,5′ GTT AGC 3′,5′ CAA TCG 3′,D
"An observer O at rest midway between two sources of light at x = 0 and x = 10 m observes the two sources to flash simultaneously. According to a second observer O', moving at a constant speed parallel to the x-axis, one source of light flashes 13 ns before the other. Which of the following gives the speed of O' relative to O?",0.13c,0.15c,0.36c,0.53c,C
"What is the greatest possible quotient of any two distinct members of the set $\{\frac{2}{5}, \frac{1}{2},5,10\}$? Specifically, we wish to maximize $\frac{x}{y}$, where $x$ and $y$ are chosen from the previous set.",5,10,20,25,D
"Which of the following procedures tend(s) to minimize the influence of random errors on measured results?
I. Signal averaging
II. Use of internal standards
III. Averaging the results from multiple samples",I only,II only,III only,I and III only,D
A number is rounded to the nearest hundred. The result is 500. Which number could not be the number before it was rounded to the nearest hundred?,458,463,547,559,D
What about asteroids makes them stand out in sky surveys searching for them?,Asteroids emit pulsed radiation,Asteroids emit a lot of their own radiation,They reflect enough of the sun's light to make them brighter than most background stars,Asteroids have substantial motion relative to the background stars,D
