question,option_A,option_B,option_C,option_D,answer
Macrostomia results from failure of fusion of,maxillary and mandibular processes.,left and right mandibular processes.,maxillary and frontonasal processes.,mandibular and hyoid arches.,A
"A student performs five titrations and obtains a mean result of 0.110 M, with a standard deviation of 0.001 M. If the actual concentration of the titrated solution is 0.100 M, which of the following is true about the titration results?",Accurate but not precise,Precise but not accurate,Both accurate and precise,Neither accurate nor precise,B
"Let V be the vector space, under the usual operations, of real polynomials that are of degree at most 3. Let W be the subspace of all polynomials p (x) in V such that p (0) = p(1) = p(-1) = 0. Then dim V + dim W is",4,5,6,7,B
"500 women aged 40 – 54 who present for routine check-ups are asked about their meat consumption the women turn out to be vegetarian. During the ensuing 5 years, 5 vegetarians and 43 non-vegetarians develop colorectal cancer. Which of the following best describes the study design?",Case series report,Cohort study,Case-control study,Cross-sectional study,A
"Of the following ionic substances, which has the greatest lattice enthalpy?",MgO,MgS,NaF,NaCl,A
Mimicry is a strategy that has evolved through natural selection to increase the fitness of organisms to their environment. Which of the following represents a form of Batesian mimicry?,A type of millipede that is toxic to a toad is permanently avoided by the toad following the toad's initial attempt to consume it.,A moth exhibits false eyes at its tail end in order to disorient predators.,A moth exhibits nearly identical coloration to that of a stinging bee.,A ground-nesting gull chick displays a coloration pattern that is nearly indistinguishable from its surroundings.,C
What type of radiation causes a black hole to evaporate over time?,Schwarzschild radiation,Planck radiation,Kolmogorov radiation,Hawking radiation,D
A substance that is NOT generally considered to be a toxic pollutant in water is,carbonic acid,a halogenated hydrocarbon,lead,mercury,A
"A fluid of density ρ flows through a horizontal pipe with negligible viscosity. The flow is streamlined with constant flow rate. The diameter of the pipe at Point 1 is d and the flow speed is V. If the diameter of the pipe at Point 2 is d/3, then the pressure at Point 2 is",less than the pressure at Point 1 by 4 ρv^2,less than the pressure at Point 1 by 40 ρv^2,more than the pressure at Point 1 by 4 ρv^2,more than the pressure at Point 1 by 40 ρv^2,B
"Before the human genome was sequenced by the Human Genome Project, scientists expected that they would find about 100,000 genes. In fact, they discovered that humans have only about 24,000 genes. How can we exhibit so many different traits from so few genes?",Modification of histone proteins usually increases the function of genes.,Epigenetics enables one gene to produce many different traits.,This is proof that pseudogenes and introns are expressed.,A single gene can produce more than one trait because of alternative splicing,D
Which of the following would increase the rate at which a gas diffuses between the alveoli of the lung and the blood within a pulmonary capillary?,Decreasing the partial pressure gradient of the gas,Decreasing the solubility of the gas in water,Increasing the total surface area available for diffusion,Decreasing the rate of blood flow through the pulmonary capillary,C
"Statement 1 | If H and K are subgroups of G and one of H or K is normal subgroup of G, then HK is a subgroup of G. Statement 2 | All groups of order p^2 where p is prime are Abelian.","True, True","False, False","True, False","False, True",A
"A silyl radical bearing an Si-H· fragment has a g value of 2.0033 and a pair of lines separated by 15.5 MHz. Express the splitting in units of mT, Gauss and cm-1.",15.5 MHz = 11.104 mT = 27.201 Gauss = 0.862 x 10^-4 cm-1,15.5 MHz = 7.352 mT = 10.104 Gauss = 18.39 x 10^-4 cm-1,15.5 MHz = 1.55 mT = 0.562 Gauss = 31.0 x 10^-4 cm-1,15.5 MHz = 0.553 mT = 5.530 Gauss = 5.17 x 10^-4 cm-1,B
Which of the following is required for both paramagnetism and ferromagnetism?,Strong oxidizing conditions,Low-spin electron configuration,Metallic physical properties,Unpaired electrons,D
Proprioceptive nerve endings in synovial joints are located in,articular cartilage and synovial membrane.,synovial membrane and capsule.,capsule and ligaments.,ligaments and articular discs.,D
A prokaryote that is thermophilic and methanogenic and has isoprenylglycerol ethers in its membrane instead of phospholipids is most likely,a proteobacterium,a spirochete,a member of the genus Chlamydia,an archaeon,D
What is not true of Jupiter's magnetic field?,it is about 20000 times stronger than Earth's magnetic field,"it traps charged particles from Io's volcanoes in a ""plasma torus"" around the planet",it causes spectacular auroral displays at Jupiter's north and south poles,it switches polarity every 11 years,D
"An organ pipe, closed at one end and open at the other, is designed to have a fundamental frequency of C (131 Hz). What is the frequency of the next higher harmonic for this pipe?",44 Hz,196 Hz,262 Hz,393 Hz,D
Which member of the paramyxovirus family can cause very serious croup?,Measles,Meta pneumo virus,Hendra,Respiratory syncytial virus (RSV),B
What is the current best option for preventing future outbreaks of Ebola?,"Rebuild scientific, medical and nursing infrastructure and train staff",Early and accurate diagnosis with molecular kits,Develop effective vaccines,Arrange rapid intervention into West Africa with EU and USA army teams,D
"The suspension cable of a 1,000 kg elevator snaps, sending the elevator moving downward through its shaft. The emergency brakes of the elevator stop the elevator shortly before it reaches the bottom of the shaft. If the elevator fell a distance of 100 m starting from rest, the heat that the brakes must dissipate to bring the elevator safely to rest is",100 J,"1,000 J","10,000 J","1,000,000 J",D
"As a blinking light source approaching you gains speed, you see the frequency of flashes",increase.,decrease.,remain unchanged.,None of these.,A
A possible effect of damage to the third cranial nerve by trauma to the orbit is,a convergent strabismus.,ptosis.,pupillary contriction.,bitemporal hemianopia.,B
Which of the following statements about post-transcriptional modification are incorrect?,A poly-A tail is added to the 3′ end of the mRNA.,A guanine cap is added to the 5′ end of the mRNA.,Introns are removed from the mRNA.,Posttranscriptional modification occurs in the cytoplasm.,D
Which of the following statements most detracts from the claim that the human appendix is a completely vestigial organ?,The appendix can be surgically removed with no immediate ill effects.,The appendix might have been larger in fossil hominids.,The appendix has a substantial amount of defensive lymphatic tissue.,Individuals with a larger-than-average appendix leave fewer offspring than those with a below-average-sized appendix.,C
Which of the following is a correct statement about the cohesion-tension theory for the ascent of water in the xylem?,The evaporation of water from leaf mesophyll cells generates tension in the water column.,Water moves from a source region with high hydrostatic pressure to a sink region with low hydrostatic pressure.,The cohesion of water molecules is responsible for the formation of embolisms (air bubbles) in the water column.,Living cells of the xylem provide the main conduit for an ascent of water.,A
A teacher puts 5 packages of craft paper into a cabinet. Each package has 80 sheets of paper. What is the total numberof sheets of craft paper that the teacher puts into the cabinet?,40,85,400,450,C
Heat comes from the Sun to Earth by the process of,conduction,convection,radiation,"All of these, although radiation is greatest",C
"If we take sin x and change it to 3 sin 2x, what will happen to the domain and range of the function?",Domain and range remain the same,Domain is double; range remains the same,Domain is tripled; range is doubled,Domain is the same; range is tripled,D
What is the Cassini division of Saturn's rings?,a dark ring visible from Earth composed of dark dusty particles,the most opaque ring of Saturn made of highly reflective ice particles,the widest ring of Saturn located between two large ring gaps,a large gap visible from Earth produced by an orbital resonance with the moon Mimas,D
Gene flow between populations results in,an increase in genetic homogeneity in the metapopulation,an increase in the rate of deleterious mutations in the metapopulation,an increased likelihood of speciation,disruption of Hardy-Weinberg equilibrium in the metapopulation,A
One astronomical unit (AU) is equal to approximately ...,130 million km,150 million km,170 million km,190 million km,B
The major risk group for HIV infection among Latinos is:,Heterosexual males,Homosexual males,Females,Injection drug users,B
"If you travel at high speed, then compared with your friends who “stay at home,” you are",older.,younger.,neither younger nor older.,longer.,B
"What happens to the pressure, P, of an ideal gas if the temperature is increased by a factor of 2 and the volume is increased by a factor of 8 ?",P decreases by a factor of 16.,P decreases by a factor of 4.,P decreases by a factor of 2.,P increases by a factor of 4.,B
Which of the following changes to a circuit will always bring about an increase in the current?,Increased voltage and increased resistance,Decreased voltage and decreased resistance,Increased voltage and decreased resistance,Decreased voltage and increased resistance,A
"Statement 1 | If a group has an element of order 10, then it has elements of orders 1, 2, and 5. Statement 2 | If a group has an element of order 2 and an element of order 3, then it has an element of order 6.","True, True","False, False","True, False","False, True",C
Emil wants to find out the most popular football team at a game between the home team and the visiting team. Which of the following methods will give him the most accurate results?,surveying the cheerleaders for the home team,surveying people wearing hats for the visiting team,surveying a group of people standing in line for tickets,surveying people who do not live in the home team’s city,C
How many positive and negative integers is $12$ a multiple of?,3,12,4,6,B
What number makes the equation 35 / ? = 7 true?,5,6,7,8,A
"Bromine has a normal boiling point of 59 °C, and iodine boils at 184 °C. The I2 molecule is much larger than Br2 (atomic radii are 114 and 133 pm, respectively). Which is the best reason for the large difference in boiling points?",Bromine is a liquid and boils; iodine is a solid and sublimes.,The intramolecular bonds in I2 are much weaker than those in Br2.,"The I2 electron clouds are much more polarizable than the Br2 electron clouds, resulting in much stronger London forces.",The mass of iodine is much greater than the mass of bromine.,C
"Statement 1 | For finite groups G and H, |G + H| = |G||H|. (G + H is the internal direct product.) Statement 2 | If r divides m and s divides n then Z_m + Z_n has a subgroup isomorphic to Z_r + Z_s.","True, True","False, False","True, False","False, True",A
Two identical capacitors are hooked in parallel to an external circuit. Which of the following quantities must be the same for both capacitors? I. the charge stored on the capacitor II.  the voltage across the capacitor III. the capacitance of the capacitor,I only,II only,II and III only,"(E) I, II, and III",D
"Suppose that for some $a,b,c$ we have $a+b+c = 6$, $ab+ac+bc = 5$ and $abc = -12$. What is $a^3+b^3+c^3$?",90,99,64,91,A
All of the following statements about plant embryogenesis are correct EXCEPT:,The suspensor is derived from the basal cell.,Cotyledons are derived from the apical cell.,Shoot apical meristem formation occurs after seed formation.,Precursors of all three plant tissue systems are formed during embryogenesis.,C
"There are 20 students in Mr. Clark's fourth-grade class. There are 5 times as many students in the entire fourth grade as there are in Mr. Clark's class. Which equation can be used to determine the number of students, n, in the entire fourth grade?",5xn= 20,5+20=n,20x5=n,20/n=5,C
What is the pH of a solution made by dissolving 0.0300 mol of sodium ethanoate in enough water to make 50 mL of solution (Ka for ethanoic acid is 1.8 × 10^-5)?,7,9.26,4.74,11.02,B
A math book and a physics book sitting on a table are tied together with a length of string. With the string taut one book is pushed off the edge of the table. As it falls the other book is dragged horizontally across the table surface. With no friction acceleration of the books is,zero,g/2,g,a value between zero and g,D
During the time an aircraft produces a sonic boom the aircraft is,breaking the sound barrier,pulling out of a subsonic dive,flying faster than sound,Each of these produces a sonic boom,C
Chemiosmosis occurs in I.Mitochondria II. Nuclei III. Chloroplasts,I only,II only,III only,I and III,D
Which would be the easiest way to burn a copper penny?,"Hold the copper penny with crucible tongs, and heat strongly in the flame of a Bunsen burner.","Use the method in (A), but use an oxyacetylene torch to reach a higher temperature.","Grind the copper penny into very small, dust-sized particles, and spray the particles into a Bunsen burner flame.","Dissolve the copper penny in acid, precipitate the hydroxide, and heat in a Bunsen burner flame to make the oxide.",C
Light that is not transmitted by opaque materials is,reflected or converted to internal energy in the material.,mainly reflected.,mainly refracted.,transmitted at a lower frequency.,A
Mai earns $5.50 per hour at her after-school job. How many hours does she have to work to earn $132?,16,20,24,28,C
"On her previous five attempts Sarah had achieved times, in seconds, of 86, 94, 97, 88 and 96, for swimming 50 meters. After her sixth try she brought her median time down to 92 seconds. What was her time, in seconds, for her sixth attempt?",92,90,87,10,B
Carbon exists in various forms called allotropes. Which of the following is not an allotrope of carbon?,diamond,soot,buckminsterfullerene,graphite,B
Use a number line to find the sum of −9 + (−8).,−17,1,−1,17,A
"A stone is thrown horizontally with an initial speed of 10 m/s from a bridge. Assuming that air resistance is negligible, how long would it take the stone to strike the water 80 m below the bridge?",1 s,2 s,4 s,8 s,C
"A fluorescent molecule of 1,000 daltons injected into one cell is observed to enter an adjacent cell by passing through a",spot desmosome,belt desmosome,gap junction,tight junction,C
"A biologist studied a population of squirrels for 15 years. During that time, the population was never fewer than 30 squirrels and never more than 45. Her data showed that over half of the squirrels born did not survive to reproduce, because of competition for food and predation. In a single generation, 90% of the squirrels that were born lived to reproduce, and the population increased to 80. Which inference(s) about this population might be true?",The amount of available food may have increased.,The number of predators may have decreased.,"The squirrels of subsequent generations should show greater levels of genetic variation than previous generations, because squirrels that would not have survived in the past will now survive.","A, B, and C",D
"Statement 1 | For n > 1, the set {1,2, ..., n-1} is a group under multiplication modulo n. Statement 2 | There is an integer x such that 63x mod 100 = 1.","True, True","False, False","True, False","False, True",D
A special feature of adaptive immunity is:,Speed of response to a foreign protein,Ability to distinguish self and non self,Ability to distinguish viruses and bacteria,Short memory,B
"Heat engines, such as a jet engine, are more efficient when run at",high temperatures,constant temperatures,low temperatures,a constant rate,A
"When we say that an individual organism has a greater fitness than another individual, we specifically mean that the organism",lives longer than others of its species.,competes for resources more successfully than others of its species.,mates more frequently than others of its species.,leaves more viable offspring than others of its species.,D
The rate of a chemical reaction is determined by,the equilibrium constant,the rate-determining or slow step of the mechanism,the reaction vessel pressure,the intermediates formed in the first step,B
In a Robertsonian translocation fusion occurs at the:,telomeres.,centromeres.,histones.,ends of the long arms.,B
What is the so-called bolometric luminosity in astronomy?,The luminosity integrated over vertically polarized wavelengths.,The luminosity integrated over horizontally wavelengths.,The luminosity integrated over visible wavelengths.,The luminosity integrated over all wavelengths.,D
Which of these makes determining the evolutionary relatedness of different species based on the amino acid sequence of homologous proteins generally less accurate than determinations of relatedness based on the nucleotide sequences of homologous genes?,Silent mutations,Gene duplications,Translocation events that change gene sequences,Crossing-over,A
Members of two different species possess a similar-looking structure that they use in a similar fashion to perform the same function. Which information would best help distinguish between an explanation based on homology versus one based on convergent evolution?,The two species live at great distance from each other.,"The two species share many proteins in common, and the nucleotide sequences that code for these proteins are almost identical.",The sizes of the structures in adult members of both species are similar in size.,Both species are well adapted to their particular environments.,B
How many positive numbers x satisfy the equation cos(97x) = x?,1,15,31,49,C
The range of disease caused by the family is wide but identify the exception from the following:,Aplastic crisis in anaemia patients,Fifth disease at 'Slapped cheek' syndrome,Foetal infection with teratogenicity,Serious pneumonia,A
"If V and W are 2-dimensional subspaces of R^4 ,what are the possible dimensions of the subspace V intersect W?",1 only,2 only,0 and 1 only,"0, 1, and 2 only",D
"A whiffle ball is tossed straight up, reaches a highest point, and falls back down. Air resistance is not negligible. Which of the following statements are true?
I. The ball’s speed is zero at the highest point.
II. The ball’s acceleration is zero at the highest point.
III. The ball takes a longer time to travel up to the highest point than to fall back down.",I only,II only,I & II only,I & III only,C
Where is the crater from the impact that is believed to be responsible for the mass extinction of dinosaurs 65 million years ago?,Tunguska Siberia.,Chicxulub Crater Yucatan Peninsula in Mexico.,Quebec Canada.,Meteor Crater in Arizona.,B
A patient is admitted after a head injury and sinks rapidly into a coma. An MRI scan indicates an extradural haemorrhage because extravasated blood can be detected between the,skull bones and dura mater.,dura mater and arachnoid.,arachnoid and pia mater.,pia mater and brain surface.,A
The standard state for redox reactions includes,the temperature is 25 °C,concentrations of soluble species are 1 molar,partial pressures of gases are 1 atmosphere,all of the above are true,D
What is the essential pathology of astroviruses?,Very restricted replication in the gut,Can cause infection of the central nervous system,Sequence diversity allows widespread replication,Can cause infection in the upper respiratory tract,A
A homeotic mutation is one which,is present in only one form in an individual,substitutes one body part for another in development,results in development of a tumor,is wild type at one temperature and abnormal at another,B
The red glow in the neon tube of an advertising sign is a result of,fluorescence.,coherence.,polarization.,de-excitation.,D
Which expression is equivalent to 5(6x + 3y)?,11x + 3y,11x + 8y,30x + 3y,30x + 15y,D
"A bag has 4 red and 6 blue marbles. A marble is selected and not replaced, then a second is selected. What is the probability that both are the same color?",\frac{1}{8},\frac{8}{15},\frac{1}{15},\frac{7}{15},D
Solve the equation −47 = g + 24.,−71,−23,23,71,B
Nitrogen's electronegativity value is between those of phosphorus and oxygen. Which of the following correctly describes the relationship between the three values?,"The value for nitrogen is less than that of phosphorus because nitrogen is larger, but greater than that of oxygen because nitrogen has a greater effective nuclear charge.",The value for nitrogen is less than that of phosphorus because nitrogen has fewer protons but greater than that of oxygen because nitrogen has less valence electrons.,"The value for nitrogen is greater than that of phosphorus because nitrogen has less electrons, but less than that of oxygen because nitrogen is smaller.","The value for nitrogen is greater than that of phosphorus because nitrogen is smaller, but less than that of oxygen because nitrogen has a smaller effective nuclear charge.",D
On which surfaces of the teeth is dental plaque most likely to accumulate in the mouth of a patient with poor oral hygiene?,The palatal surfaces of the upper molars and lingual surfaces of the lower incisors.,The buccal surfaces of the upper molars and lingual surfaces of the lower incisors.,The palatal surfaces of the upper molars and labial surfaces of the lower incisors.,The buccal surfaces of the upper molars and labial surfaces of the lower incisors.,B
Use mental math to find the sum of 11.7 + 3.4 + 6.3.,20.3,20.4,21.4,22.4,C
"Which of the following depicts the correct sequence of membranes of the chloroplast, beginning with the innermost membrane and ending with the outermost membrane?","Thylakoid membrane, inner membrane, outer membrane","Inner membrane, outer membrane, thylakoid membrane","Outer membrane, inner membrane, thylakoid membrane","Strama, outer membrane, inner membrane",A
The highest ocean tides occur when Earth and the Moon are,lined up with the Sun,at right angles to the Sun,at any angle to the Sun,lined up during spring,A
Why is Saturn almost as big as Jupiter despite its smaller mass?,Jupiter's greater mass compresses it more thus increasing its density.,Saturn has a larger proportion of hydrogen and helium than Jupiter and is therefore less dense.,Jupiter's strong magnetic field constrains its size.,Saturn is further from the Sun thus cooler and therefore less compact.,A
"When a cannonball is fired from a cannon, both the cannonball and the cannon experience equal",amounts of force,accelerations,Both,Neither,A
Magazines costs $2.99 each and books costs $6.99 each at the Old Town Newsstand. What is the total cost of 4 magazines and 3 books?,$20.93 ,$28.93 ,$32.93 ,$48.93 ,C
Which ratio CANNOT form a proportion with 8 over 18?,46 over 108,12 over 27,60 over 135,4 over 9,A
Which of the following statements about nuclear binding energies is NOT true?,Binding energy per nucleon reaches a maximum for 56Fe.,Nuclear binding energies have about the same magnitude as chemical bond energies.,Nuclei have slightly less mass than the sum of their component nucleons.,The nuclei of heavy elements have more neutrons than protons in order to provide sufficient binding energy to hold the nuclei together.,B
"When 100 J are put into a device that puts out 40 J of useful work, the efficiency of the device is",40%,50%,60%,140%,A
Calculate spin density on the central carbon atom of malonic acid radical (•CH(COOH)2) if the hyperfine value for the α-hydrogen atom is 21.9 G.,0.95,0.85,0.15,0.65,C
Which set of integers is in order from least to greatest?,"−9, −6, −3, 7, 11","−3, −6, 7, 11, –9","11, −9, 7, −6, −3","7, 11, −6, −3, −9",A
What is the morphology of the Dane particle?,Double shelled icosahedron,Lipid membrane free icosahedron,Flexuous and filamentous morphology,Numerous small particles,C
"Regarding meiosis and mitosis, one difference between the two forms of cellular reproduction is that in meiosis","there is one round of cell division, whereas in mitosis there are two rounds of cell division","separation of sister chromatids occurs during the second division, whereas in mitosis separation of sister chromatids occurs during the first division","chromosomes are replicated during interphase, whereas in mitosis chromosomes are replicated during prophase","spindle fibers form during prophase, whereas in mitosis the spindle fibers form during metaphase",B
"Statement 1 | f : X → Y is continuous and X is compact. f must be uniformly continuous. Statement 2 | If f(x), g(x) : R → R are everywhere differentiable f(g(x)) must be everywhere differentiable.","True, True","True, False","False, True","False, False",A
"If $m$ and $n$ are odd integers, how many terms in the expansion of $(m+n)^6$ are odd?",4,2,1,9,A
An airplane with its nose pointing north with an airspeed of 40 km/h in a 30-km/h crosswind (at right angles) has a groundspeed of,30 km/h,40 km/h,50 km/h,60 km/h,C
"In the formation of the earliest cells, which of the following components most likely arose first?",Nucleus,Plasma membrane,Mitochondrion,Flagellum,B
If 3 cans of pears cost $2.37 how many cans of pears can you buy for $9.48?,3 cans,12 cans,36 cans,13 cans,B
How many people globally are currently infected with hepatitis B?,350 million,2 billion,"100,000",1 million,A
"A 2.35-gram sample was dissolved in water, and the chloride ions were precipitated by adding silver nitrate (Ag+ + Cl- → AgCl). If 0.435 g of precipitate was obtained, what is the percentage of chlorine in the sample?",10.80%,4.60%,43.50%,18%,B
