question,option_A,option_B,option_C,option_D,answer
During an inferior alveolar nerve block the needle ideally passes,posterior and medial to medial pterygoid.,anterior and lateral to medial pterygoid.,through medial pterygoid.,inferior to medial pterygoid.,B
How do scientists know that the majority of meteorites come from the asteroid belt?,The spectra of some meteorites are similar to the spectra of asteroids in the asteroid belt.,The asteroid belt is the only possible source of meteorites therefore they must originate there.,Collisions are common in the asteroid belt and we can track the fragments from their source asteroid to the Earth where they become meteorites.,High levels of Iridum have been detected in both asteroids and meteorites therefore meteorites come from the asteroid belt.,A
The surface of Planet Earth loses energy to outer space due mostly to,conduction.,convection.,radiation.,radioactivity.,C
How can the spread of filoviruses be restricted?,New antivirals,New humanised monoclonal antibodies,Hygiene and social distancing,New vaccines,C
Which phrase is a description of 2m+7?,7 more than 2 times m,2 more than 7 times m,2 times the sum of 7 and m,7 times the sum of 2 and m,A
Which of the following statements is true of air as compared to water?,Air provides more physical support.,Air has a higher O2 concentration.,Air offers more resistance to motion.,Air has more thermal inertia.,B
"If f: R -> R is a bounded function that is Lebesgue integrable, then which of the following must be true?",f is Riemann integrable.,There does not exist a countably infinite E of R such that f is nondifferentiable at every x \in E.,There does not exist an uncountable subset E of R such that f is nondifferentiable at every x \in E.,None of the above.,D
"Statement 1 | In a finite dimensional vector space every linearly independent set of vectors is contained in a basis. Statement 2 | If B_1 and B_2 are bases for the same vector space, then |B_1| = |B_2|.","True, True","False, False","True, False","False, True",A
Find the characteristic of the ring Z_3 x Z_3.,0,3,12,30,B
"The amount of paint that David needs to cover a cube is directly proportional to the surface area. If David can completely cover a cube of side length 2 feet with exactly 16 quarts of paint, how big a cube (in terms of edge length in feet) can David cover with 169 quarts of paint?",\frac{13}{4},8,\frac{13}{2},13,C
"A resistor in a circuit dissipates energy at a rate of 1 W. If the voltage across the resistor is doubled, what will be the new rate of energy dissipation?",0.25 W,0.5 W,1 W,4 W,D
Mobile regions of DNA capable of inserting themselves into an existing genome are,prions,cistrons,introns,transposons,D
"(Z,*) is a group with a*b = a+b+1 for all a, b in Z. The inverse of a is",0,-2,a-2,(2+a)*-1,D
Evaluate the sum\[\frac{1}{2^1} + \frac{2}{2^2} + \frac{3}{2^3} + \cdots + \frac{k}{2^k} + \cdots \],\infty,1,2,4,C
"What is the smallest whole number that has a remainder of 1 when divided by 4, a remainder of 1 when divided by 3, and a remainder of 2 when divided by 5?",67,43,57,37,D
"A beam of electrons has speed 10^7 m/s. It is desired to use the magnetic field of the Earth, 5 × 10−5 T, to bend the electron beam into a circle. What will be the radius of this circle?",1 nm,1 μm,1 mm,1 m,D
"The T2 of an NMR line is 15 ms. Ignoring other sources of linebroadening, calculate its linewidth.",0.0471 Hz,21.2 Hz,42.4 Hz,66.7 Hz,B
What is three fifth of 100?,3,5,20,60,D
Which of the following paranasal sinuses open into the middle meatus?,The anterior ethmoidal sinuses,The anterior ethmoidal and frontal sinuses,"The anterior ethmoidal, frontal and maxillary sinuses","The anterior ethmoidal, frontal, maxillary and sphenoidal sinuses",C
"If neutral variation is truly ""neutral,"" then it should have no effect on",nucleotide diversity.,average heterozygosity.,our ability to measure the rate of evolution.,relative fitness.,D
Protein that prevents the binding of RNA polymerase to the promoter site.,Enhancer,Repressor,Operator,Promoter,B
"An object of mass m1 experiences a linear, elastic collision with a stationary object of unknown mass. In addition to m1, what is the minimum necessary information that would allow you to determine the mass of the second object?",The final speed of object 1,The initial speed of object 1,The final speed of object 2,Any 2 of the above values,D
Identify the Brønsted-Lowry conjugate acid-base pair in the following list.,H3O+ and OH-,H3PO4 and H2PO4-,HClO4 and ClO3-,SO32- and HSO2-,B
"Let A and B be sets, f: A -> B and g: B -> A be functions such that for all a \in A, g(f(a)) = a. Statement 1 | The function f must necessarily be injective. Statement 2 | The function f must necessarily be surjective.","True, True","False, False","True, False","False, True",C
"How many electrons, neutrons, and protons are in an atom of Cr?","24 electrons, 24 protons, 24 neutrons","27 electrons, 27 protons, 24 neutrons","24 electrons, 28 protons, 24 neutrons",more information is needed to answer this question,D
There are 10 red chips and 5 blue chips in a bag. What are the chances of picking a blue chip if you reach into the bag and pick one without looking?,1 out of 5,2 out of 15,5 out of 10,5 out of 15,D
The cell type comprising the pith tissue centered within a dicot stem is the,parenchyma,sclerenchyma,vascular cambium,vascular bundle,A
Which component of transcribed RNA in eukaryotes is present in the initial transcript but is removed before translation occurs?,Intron,3’ Poly A tail,Ribosome binding site,5’ cap,A
"A patient cuts a peripheral motor nerve in their wrist when they fall through a plate glass window. If the nerve does not regenerate, after about 6 months the muscles it normally innervates will show signs of which of the four options below?",spastic paralysis,flaccid paralysis,atrophy,contracture,C
"A 3-microfarad capacitor is connected in series with a 6-microfarad capacitor. When a 300-volt potential difference is applied across this combination, the total energy stored in the two capacitors is",0.09 J,0.18 J,0.27 J,0.41 J,A
Which muscle is the most active during a right lateral excursion of the mandible?,Left lateral pterygoid muscle,Right lateral pterygoid muscle,Left medial pterygoid muscle,Right medial pterygoid muscle,A
Identify the most commonly used diagnostic technique in the virus laboratory:,Virus isolation in cell culture,Deep sequencing (NGS),Reverse transcriptase (RT) PCR,Immuno-serology,B
The energy of an emitted photon is related to its,amplitude,polarization,momentum,frequency,D
"Let R be a ring with a multiplicative identity. If U is an additive subgroup of R such that ur in U for all u in U and for all r in R, then U is said to be a right ideal of R. If R has exactly two right ideals, which of the following must be true?
I. R is commutative.
II. R is a division ring (that is, all elements except the additive identity have multiplicative inverses).
III. R is infinite.",I only,II only,III only,I and II only,B
Many marine birds drink seawater yet maintain their internal osmolarity at a constant level that is hypoosmotic to seawater. Which of the following physiological strategies best explains how the birds maintain their tissue osmolarity?,Marine birds absorb water from the environment through specialized salt-exchange glands and produce large volumes of dilute urine in the kidneys.,Marine birds absorb salts from the environment through specialized salt-exchange glands and produce large volumes of concentrated urine in the kidneys.,Marine birds excrete salts through specialized salt-exchange glands and excrete small volumes of urine.,Marine birds excrete salts and nitrogenous wastes through specialized nasal glands.,C
The major concentrations of proprioceptive receptors providing information about position of the TMJ are located in,the capsule and ligaments of the TMJ and the medial pterygoid muscle.,the capsule and ligaments of the TMJ and the lateral pterygoid muscle.,the articular disc of the TMJ and the medial pterygoid muscle.,the articular disc of the TMJ and the lateral pterygoid muscle.,B
How did Eratosthenes estimate the size of Earth in 240 B.C.?,By observing the duration of a solar eclipse.,By measuring the size of Earth's shadow on the Moon in a lunar eclipse.,By comparing the maximum altitude of the Sun in two cities at different latitudes at the same time on the same day.,By sending fleets of ships around Earth.,C
"A convex lens of focal length f = 0.2 m is used to examine a small coin lying on a table. During the examination, the lens is held a distance 0.3 m above the coin and is moved slowly to a distance of 0.1 m above the coin. During this process, what happens to the image of the coin?",The image continually increases in size.,The image continually decreases in size.,The image gets smaller at first and then bigger in size.,The image flips over.,D
How much work is required to charge a 10 µF capacitor to a potential difference of 100 V ?,0.005 J,0.01 J,0.05 J,0.1 J,C
What is the range of the function $f(x) = \frac{1}{1-x}$? Express your answer in interval notation.,"(-\infty,-1)\cup (1,\infty)","(-\infty,0)\cup (0,\infty)","[-1,1]","(-1,1)",B
"Calculate the relative occupancies of the α and β spin energy levels for a radical species with g = 2.05, at L- and W-band frequencies (take TS = 300 K).",Nα/Nβ = 0.9800 at L-band; Nα/Nβ = 0.9509 at W-band,Nα/Nβ = 0.9950 at L-band; Nα/Nβ = 0.9609 at W-band,Nα/Nβ = 0.9910 at L-band; Nα/Nβ = 0.9709 at W-band,Nα/Nβ = 0.9850 at L-band; Nα/Nβ = 0.9809 at W-band,D
"White light is normally incident on a puddle of water (index of refraction 1.33). A thin (500 nm) layer of oil (index of refraction 1.5) floats on the surface of the puddle. Of the following, the most strongly reflected wavelength is",500 nm,550 nm,600 nm,650 nm,C
(i + 1)(5 – 5i)(5 + 5i) =,50 + 50i,50 – 50i,25 + 25i,25 – 25i,A
What is the ratio of line intensities in the EPR spectrum of the t-Bu radical (CH3)3C•?,1:19:36:84:126:126:84:36:19:1,1:9:36:84:126:126:84:36:9:1,1:9:35:82:120:120:82:35:9:1,1:8:28:56:70:56:28:8:1,D
"Statement 1 | If A is connected, the closure of A must be connected. Statement 2 | Every continuous function f : (0, 1) → (0, 1) has a fixed point.","True, True","True, False","False, True","False, False",B
A group of students played a basketball game after school. Which total can be found using the expression 7 x 2?,the total number of points if a player made 7 shots and each shot was worth 2 points,the total number of basketballs if 7 basketballs were old and 2 basketballs were new,the total number of points if one player had 7 points and a different player had 2 points,the total number of basketballs used if there were 7 basketballs and 2 of the basketballs were not used,A
Find 4 over 7 + 2 over 7.,6 over 14,8 over 49,14 over 28,6 over 7,D
Which of the following is/are true?,Titan is the only outer solar system moon with a thick atmosphere,Titan is the only outer solar system moon with evidence for recent geologic activity,Titan's atmosphere is composed mostly of hydrocarbons,A and D,D
A solution of a weak base is titrated with a solution of a standard strong acid. The progress of the titration is followed with a pH meter. Which of the following observations would occur?,"Initially, the pH slowly decreases, then there is a rapid decrease to give a pH below 7 at the equivalence point.",The pH of the solution gradually decreases throughout the experiment and the pH at the equivalence point is below 7.,"Initially, the pH slowly decreases, then there is a rapid decrease to give a pH equal to 7 at the equivalence point.","Initially, the pH quickly decrease, then there is a gradual decrease to the equivalence point where the pOH equals the pKb of the base.",A
The energy given up by electrons as they move through the electron transport chain is used to,break down glucose,make glucose,produce ATP,make NADH,C
"Hypochlorous acid is an unstable compound, and one of the decomposition products is chlorine gas, Cl2. The decomposition of the acid lowers its concentration over time. What effect will the decomposition of one-fourth of the acid have on the agreement between the endpoint of the titration and the equivalence point during a titration with standard sodium hydroxide?",The endpoint would still remain near the ideal equivalence point.,The endpoint would be after the ideal equivalence point.,The endpoint would be before the ideal equivalence point.,It is impossible to determine.,C
Members of which of the following groups are most likely to be surrounded by a protein coat?,Viruses,Bacteria,Eukaryotes,Archaea,A
"According to four-dimensional geometry, the angles of a triangle add to 180°",always.,sometimes.,never.,on planet Earth only.,B
"Hydrogen fluoride, HF, is a liquid at 15°C. All other hydrogen halides (represented by HX, where X is any other halogen) are gases at the same temperature. Why?",Fluorine has a very high electronegativity; therefore the H-F bond is stronger than any other H-X bond.,HF is smaller than any other H-X molecule; therefore it exhibits stronger London dispersion forces.,The dipoles in a HF molecule exhibit a particularly strong attraction force to the dipoles in other HF molecules.,The H-F bond is the most ionic in character compared to all other hydrogen halides.,C
Invertebrate immune systems possess which of the following?,Cytotoxic T-lymphocytes,Phagocytes,B-cells,Helper T-cells,B
The magnitude of the gravitational force on a satellite is constant if the orbit is,parabolic,circular,elliptical,All of these,B
Solve the equation −17.02 = −2.3y. Check your answer.,7.4,−7.4,−19.32,14.72,A
"An organism exposed to wild temperature fluctuations shows very little, if any, change in its metabolic rate. This organism is most probably a",ectotherm.,endotherm.,thermophyle.,ascospore.,B
Which of the following describes a symbiotic relationship?,A tapeworm feeds off of its host's nutrients causing the host to lose large amounts of weight.,"Certain plants grow on trees in order to gain access to sunlight, not affecting the tree.","Remora fish eat parasites off of sharks; the sharks stay free of parasites, and the remora fish are protected from predators.",Meerkats sound alarm calls to warn other meerkats of predators.,C
The relationship between the vapor pressure of a liquid and the heat of vaporization is expressed in the,Rydberg equation,Gibbs free energy equation,Clausius-Clapeyron equation,Arrhenius equation,C
"A ball of mass is attached to a string connected to the ceiling, forming a pendulum. When the string is raised to an angle of 50 degrees below the horizontal (the ceiling) and released, the ball swings back and forth with a period of 0.4 s. Which of the following changes to the pendulum would decrease the period of the pendulum?",Increasing the mass of the ball,Decreasing the length of the string,Decreasing the angle of the string from the horizontal when released,Decreasing the mass of the ball,B
"Let x_1 = 1 and x_(n+1) = sqrt(3+2x_n) for all positive integers n. If it is assumed that {x_n} converges, then lim x_n =",3,e,sqrt(5),0,A
Which of the following statements explains how a point mutation can have no negative impact in the protein formed from a sequence in DNA?,"The first codon of a gene is always AUG, a leader sequence; a mutation in that sequence will have no effect on the protein produced.",Several codons code for the same amino acid.,DNA polymerase and DNA ligase carry out excision repair before transcription.,RNA processing will repair point mutations before mRNA leaves the nucleus.,B
Statement 1 | 4x - 2 is irreducible over Z. Statement 2 | 4x - 2 is irreducible over Q.,"True, True","False, False","True, False","False, True",D
Positive integers $x$ and $y$ have a product of 56 and $x < y$. Seven times the reciprocal of the smaller integer plus 14 times the reciprocal of the larger integer equals 4. What is the value of $x$?,13,14,1,2,D
The compressions and rarefactions in sound normally travel,in the same direction,in opposite directions,at right angles to each other,None of these,A
Juan rolls a fair regular octahedral die marked with the numbers 1 through 8. Then Amal rolls a fair six-sided die. What is the probability that the product of the two rolls is a multiple of 3?,\frac{1}{2},\frac{1}{4},\frac{1}{144},\frac{1}{288},A
Chris sells roses for $16.99 a bunch. At the end of the day he has collected $339.80. How many bunches of roses did he sell?,22,18,20,16,C
"Pat bounces a basketball 25 times in 30 seconds. At that rate, approximately how many times will Pat bounce the ball in 150 seconds?",120,125,144,145,B
"The standard tip in a restaurant is $ 15 \%$ of the bill before tax. Many people in California find the tip by doubling the sales tax, which is $8.25 \%$. By how many cents does this exceed the standard tip on a bill of $ \$60 $ before tax?",90,80,70,60,A
Which of the following statements best describes what a Barr body is and its significance?,It is an inactivated Y chromosome and results in a man being sterile.,"It is an inactivated Y chromosome, and the person who has it appears female.",It is an inactivated X chromosome and results in females with half their cells having one X inactivated and the other half of their cells having the other X inactivated.,It is an inactivated X chromosome and results in females who are sterile.,C
"Each story of a building is 14.3 feet tall. If the height of the building is 185.9 feet, how many floors does the building have?",10,13,17,9,B
"At the present time, the temperature of the universe (i.e., the microwave radiation background) is about 3 K. When the temperature was 12 K, typical objects in the universe, such as galaxies, were",one-quarter as distant as they are today,one-half as distant as they are today,separated by about the same distances as they are today,two times as distant as they are today,A
The spheno-occipital synchondrosis,is a secondary growth cartilage.,influences the position of the viscerocranium.,ceases activity at 7 years of age.,can be reactivated in patients affected by acromegaly.,B
"Compared to DNA viral replication, RNA viral replication is more susceptible to mutation because","RNA replication takes place in the cytoplasm, whereas DNA replication takes place in the nucleus.",RNA viruses replicate much faster than DNA viruses.,RNA viruses use uracil instead of thymine.,RNA replication lacks the proofreading functions characteristic of DNA replication.,D
Parasympathetic preganglionic nerves leave the central nervous system with the,third cranial nerves.,fourth cranial nerves.,fifth cranial nerves.,sixth cranial nerves.,A
"Cell motility, as viewed in a cultured fibroblast, encompasses all of the following EXCEPT",adhesion plaques,vinculin,clathrin,lamellipodia,C
"Cerium(III) sulfate, Ce2(SO4)2, is less soluble in hot water than it is in cold. Which of the following conclusions may be related to this?",The heat of solution of cerium(III) sulfate is exothermic.,The hydration energies of cerium ions and sulfate ions are very low.,The heat of solution for cerium(III) sulfate is endothermic.,The solution is not an ideal solution.,A
Molly got a haircut for $25 and she left a 15% tip. What was Molly’s final cost?,$25.15 ,$26.50 ,$27.50 ,$28.75 ,D
"In a hydraulic press operation, the output piston cannot",move farther than the input piston,exceed the force input,exceed the input piston’s speed,produce increased energy,D
The first groups of animals to develop lung tissue adequate to support their respiratory requirements without the use of supplementary gas exchange organs were the,amphibians,reptiles,mammals,trematoda,B
The highest risk of HIV infection among drug users in the U.S. is in:,The east coast,"The central United States (Kansas, Missouri etc.)",Southern California,"The Pacific Northwest (Washington, Oregon, Idaho)",A
"Patricia’s annual starting salary at her new job is $20,000. After one year on the job, her salary increases by 10%; after her second year on the job, her salary increases by 10% more over the previous year’s salary. After these two years have passed, what would her salary be?","$24,200","$24,000","$22,000","$4,000",A
Positive stranded RNA viruses have which of the following characteristics?,Their genome RNA can be translated directly as mRNA,They have to transcribe their genome RNA to a mirror image copy as a mRNA,This genome is circular,Their RNA genome is segmented,A
Which of the following concerning uniform circular motion is true?,The centrifugal force is the action-reaction pair of the centripetal force.,The centripetal acceleration and velocity point in the same direction.,The velocity of the object in motion changes whereas the acceleration of the object is constant.,A satellite undergoing uniform circular motion is falling toward the center in a circular path.,D
Moons cause/contribute to which of the following?,stability of particles within rings.,gravitational effects at ring edges as the moons pass by.,gaps between rings.,Moons contribute to all of the above.,D
Which of the following molecules cannot hydrogen bond with molecules identical to itself but can hydrogen bond with one of the molecules above or below it in the following responses?,CH3CH2OH,CH3CH2COOH,CH3CH2CHO,C6H5CHO,C
The structures that act as sites of gas exchange in a woody stem are the,lenticels,terminal buds,nodes,internodes,A
"If a pentagon P with vertices at (– 2, – 4), (– 4, 1), (–1, 4), (2, 4), and (3, 0) is reflected across the line y = x to get a new pentagon, P’, then one of the vertices of P’ is","(0, – 3)","(4, 1)","(2, 2)","(– 4, –2)",D
A healthy person sitting at rest consciously begins to breathe too fast. Which of the following describes the change in the person’s blood caused by this hyperventilation?,A decrease in partial pressure of carbon dioxide and an increase in concentration of hydrogen ions,A decrease in partial pressure of carbon dioxide and a decrease in concentration of hydrogen ions,An increase in partial pressure of carbon dioxide and an increase in concentration of hydrogen ions,An increase in partial pressure of carbon dioxide and a decrease in concentration of hydrogen ions,B
Evaluate −2(x − 3) for x = 2.,−4,−2,10,2,D
Which of the following is considered a metalloid?,Cr,Mn,Si,S,C
Mitochondria isolated and placed in a buffered solution with a low pH begin to manufacture ATP. Which of the following is the best explanation for the effect of low external pH?,"It increases the concentration of OH-, causing the mitochondria to pump H+ to the intermembrane space.",It increases the OH- concentration in the mitochondria matrix.,It increases the acid concentration in the mitochondria matrix.,It increases diffusion of H+ from the intermembrane space to the matrix.,D
"A rock drops onto a pond with a smooth surface. A few moments later, the wave produced by the rock’s impact arrives at the shore, touching the ankles of a wading child. Which of the following observations provides evidence that the portion of the wave hitting the child’s ankles carries less energy than the wave did when it was first created by the rock’s impact?",The wave is moving more slowly.,The wave pulse’s width has become greater.,The wave pulse’s width has become smaller.,The wave’s height has become smaller.,D
A marine ecosystem region characterized by penetrance of solar radiation and upwelling of nutrients is the,bathyl zone,neritic zone,pelagic zone,benthyl zone,B
"If a clock chimes every hour the same number of times as the hour it is (e.g., at 3 P.M. it chimes 3 times) and once for every 15-minute increment between hours (e.g., at 3:15, 3:30, and 3:45), what will the total number of chimes be between 5:10 and 7:35 P.M.?",3,15,18,21,D
The graph of the equation $x + 2y + 3 = 0$ is perpendicular to the graph of the equation $ax + 2y + 3 = 0$. What is the value of $a$?,-4,-13,-9,-15,A
"Mr. Cleary’s class and Ms. Ntuala’s class go to use the computer lab. There are 20 computers available, two of which do not work. Mr. Cleary’s class has 14 kids, and Ms. Ntuala’s class has 12 kids. If every student must use a computer and there can only be 2 students on a computer at most, what is the maximum number of students who can have a computer to themselves?",2,6,10,14,C
Why do scientists think Mars was once warmer and wetter?,Mars shows evidence of significant volcanism which implies that the climate was once warmer and therefore wetter,early observations showed what appeared to be changing vegetation patterns and canals indicating the presence of water,there are many geologic features on Mars that are difficult to explain unless liquid water was once stable at the surface,all planets tend to begin with warm wet climates and gradually become cold and dry with smaller planets cooling faster than larger planets,C
From laboratory measurements we know that a particular spectral line formed by hydrogen appears at a wavelength of 486.1 nanometers (nm). The spectrum of a particular star shows the same hydrogen line appearing at a wavelength of 485.9 nm. What can we conclude?,The star is getting hotter.,The star is getting colder.,The star is moving toward us.,The star is moving away from us.,C
Approximately what fraction of the human genome encodes proteins?,2%,25%,50%,90%,A
Statement 1 | Every integral domain with characteristic 0 is infinite. Statement 2 | Every integral domain with prime characteristic is finite.,"True, True","False, False","True, False","False, True",C
All of the following characteristics are typical of r-selected species EXCEPT,high reproductive rate,small body size,occupancy of unstable environments,high competitive ability,D
